{
  "$schema": "../schemas/decision-request.schema.json",
  "schema_version": 1,
  "id": "DEC-001",
  "status": "PENDING",
  "cycle": "CYCLE-001",
  "stage": 1,
  "input_type": "single_select",
  "question": "需要确认的决策问题",
  "why_now": "为什么当前 Stage 必须得到用户确认",
  "options": [
    {
      "id": "A",
      "title": "方案 A",
      "summary": "方案 A 的核心结果",
      "tradeoffs": "方案 A 的主要代价"
    },
    {
      "id": "B",
      "title": "方案 B",
      "summary": "方案 B 的核心结果",
      "tradeoffs": "方案 B 的主要代价"
    }
  ],
  "recommended": "A",
  "allow_custom": true,
  "allow_multiple": false,
  "allow_rank": false,
  "evidence_refs": [],
  "affected_areas": []
}
